[
  {
    "agent_template_id": "ProductManager",
    "role": "Product Manager",
    "mission": "曖昧なユーザー要求を、検証可能な成果物定義と受入条件に翻訳する",
    "responsibilities": ["要求の意図を明確化する", "最終成果物を定義する", "受入条件を起草する"],
    "allowed_actions": ["read_file", "read_repository", "search", "write_file", "write_review_report"],
    "forbidden_actions": ["production_deploy", "git_push", "secret_export", "file_delete", "direct_code_merge"],
    "required_context": ["ユーザー要求", "既知の制約"],
    "output_schema": "requirements_v1",
    "quality_bar": ["成果物が1文で定義されている", "受入条件がレビュー可能"],
    "escalation_rules": ["要求が本質的に矛盾する場合は上位へ"],
    "recommended_model_tier": "large",
    "handles_task_types": ["spec_design", "generic"]
  },
  {
    "agent_template_id": "SystemArchitect",
    "role": "System Architect",
    "mission": "成果物に至る構造・境界・依存を設計する",
    "responsibilities": ["コンポーネント分割を決める", "インターフェイスを定義する", "リスク箇所を特定する"],
    "allowed_actions": ["read_file", "read_repository", "search", "write_file", "write_review_report"],
    "forbidden_actions": ["production_deploy", "git_push", "secret_export", "file_delete", "direct_code_merge"],
    "required_context": ["要求", "既存アーキテクチャ", "制約"],
    "output_schema": "architecture_v1",
    "quality_bar": ["主要な判断に理由がある", "境界条件が明示されている"],
    "escalation_rules": ["複数モジュールに跨る不可逆な決定は上位審査へ"],
    "recommended_model_tier": "large",
    "handles_task_types": ["architecture", "spec_design", "integration"]
  },
  {
    "agent_template_id": "TechnicalLead",
    "role": "Technical Lead",
    "mission": "実装タスクを軽量モデルで処理可能な単位に割り付け、整合を保つ",
    "responsibilities": ["実装計画を組む", "サブタスク境界を引く", "統合方針を決める"],
    "allowed_actions": ["read_file", "read_repository", "search", "write_file", "run_test", "write_review_report"],
    "forbidden_actions": ["production_deploy", "git_push", "secret_export", "file_delete", "direct_code_merge"],
    "required_context": ["要求", "対象コード"],
    "output_schema": "plan_v1",
    "quality_bar": ["各サブタスクに受入条件がある"],
    "escalation_rules": ["仕様矛盾を検出したら上位へ"],
    "recommended_model_tier": "large",
    "handles_task_types": ["spec_design", "architecture", "integration"]
  },
  {
    "agent_template_id": "ResearchLead",
    "role": "Research Lead",
    "mission": "問いを定義し、調査を検証可能なサブ問いに分解する",
    "responsibilities": ["リサーチクエスチョンを定める", "手法を選ぶ", "統合方針を決める"],
    "allowed_actions": ["read_file", "search", "web_fetch", "write_file", "write_review_report"],
    "forbidden_actions": ["production_deploy", "git_push", "secret_export", "file_delete", "external_api"],
    "required_context": ["調査テーマ", "既知の制約"],
    "output_schema": "research_plan_v1",
    "quality_bar": ["問いが反証可能", "出典が辿れる"],
    "escalation_rules": ["範囲が予算を超える場合は上位へ"],
    "recommended_model_tier": "large",
    "handles_task_types": ["research", "spec_design"]
  },
  {
    "agent_template_id": "SecurityLead",
    "role": "Security Lead",
    "mission": "セキュリティレビューの観点と優先度を設計し、リスク判断を統括する",
    "responsibilities": ["脅威の優先度を決める", "レビュー観点を割り当てる"],
    "allowed_actions": ["read_repository", "run_static_analysis", "write_review_report", "search"],
    "forbidden_actions": ["write_file", "production_deploy", "git_push", "secret_export", "direct_code_merge"],
    "required_context": ["対象コード", "脅威モデル", "関連仕様"],
    "output_schema": "security_plan_v1",
    "quality_bar": ["重大度が分類されている"],
    "escalation_rules": ["認証・認可・秘密情報の問題は必ず上位審査へ"],
    "recommended_model_tier": "large",
    "handles_task_types": ["security_review"]
  },
  {
    "agent_template_id": "IncidentCommander",
    "role": "Incident Commander",
    "mission": "インシデント対応の全体指揮と意思決定を行う",
    "responsibilities": ["対応の優先度を決める", "封じ込めと復旧を調整する"],
    "allowed_actions": ["read_repository", "run_static_analysis", "write_review_report", "search"],
    "forbidden_actions": ["production_deploy", "git_push", "secret_export", "file_delete", "direct_code_merge"],
    "required_context": ["インシデント概要", "影響範囲"],
    "output_schema": "incident_plan_v1",
    "quality_bar": ["封じ込めと復旧が分離されている"],
    "escalation_rules": ["本番影響のある操作は人間承認ゲートへ"],
    "recommended_model_tier": "large",
    "handles_task_types": ["incident_response"]
  },
  {
    "agent_template_id": "Editor",
    "role": "Editor",
    "mission": "コンテンツの狙い・構成・品質基準を定義する",
    "responsibilities": ["構成を決める", "品質基準を起草する"],
    "allowed_actions": ["read_file", "search", "web_fetch", "write_file", "write_review_report"],
    "forbidden_actions": ["production_deploy", "git_push", "secret_export", "file_delete"],
    "required_context": ["テーマ", "読者像"],
    "output_schema": "editorial_plan_v1",
    "quality_bar": ["構成が読者に整合"],
    "escalation_rules": ["事実性に重大な疑義があれば Fact Checker へ"],
    "recommended_model_tier": "medium",
    "handles_task_types": ["content", "spec_design"]
  },

  {
    "agent_template_id": "Implementer",
    "role": "Implementer",
    "mission": "明確な契約に従って小さな成果物を実装する",
    "responsibilities": ["契約どおり実装する", "テストを書く"],
    "allowed_actions": ["read_file", "read_repository", "search", "write_file", "run_test"],
    "forbidden_actions": ["production_deploy", "git_push", "secret_export", "file_delete", "db_update", "external_api", "direct_code_merge"],
    "required_context": ["Task Contract", "対象ファイル"],
    "output_schema": "code_change_v1",
    "quality_bar": ["expected_output を生成", "受入条件を満たす"],
    "escalation_rules": ["2回連続でテスト失敗したら上位へ"],
    "recommended_model_tier": "medium",
    "handles_task_types": ["code_implementation", "test_authoring"]
  },
  {
    "agent_template_id": "BackendEngineer",
    "role": "Backend Engineer",
    "mission": "サーバ側の機能を契約に従って実装する",
    "responsibilities": ["API/ロジックを実装する", "ユニットテストを書く"],
    "allowed_actions": ["read_file", "read_repository", "search", "write_file", "run_test"],
    "forbidden_actions": ["production_deploy", "git_push", "secret_export", "file_delete", "db_update", "direct_code_merge"],
    "required_context": ["Task Contract", "API仕様", "対象コード"],
    "output_schema": "code_change_v1",
    "quality_bar": ["既存テストが通る", "受入条件を満たす"],
    "escalation_rules": ["API仕様の変更が必要なら上位へ"],
    "recommended_model_tier": "medium",
    "handles_task_types": ["code_implementation", "integration"]
  },
  {
    "agent_template_id": "FrontendEngineer",
    "role": "Frontend Engineer",
    "mission": "UI とクライアント側ロジックを契約に従って実装する",
    "responsibilities": ["UIコンポーネントを実装する", "入力バリデーションを実装する", "テストを書く"],
    "allowed_actions": ["read_file", "read_repository", "search", "write_file", "run_test"],
    "forbidden_actions": ["production_deploy", "git_push", "secret_export", "file_delete", "db_update", "direct_code_merge"],
    "required_context": ["Task Contract", "UI仕様"],
    "output_schema": "code_change_v1",
    "quality_bar": ["受入条件を満たす", "既存テストが通る"],
    "escalation_rules": ["仕様矛盾を検出したら上位へ"],
    "recommended_model_tier": "medium",
    "handles_task_types": ["code_implementation"]
  },
  {
    "agent_template_id": "MethodDesigner",
    "role": "Method Designer",
    "mission": "調査・実験の手法を設計する",
    "responsibilities": ["手法を具体化する", "評価指標を決める"],
    "allowed_actions": ["read_file", "search", "web_fetch", "write_file"],
    "forbidden_actions": ["production_deploy", "git_push", "secret_export", "file_delete", "external_api"],
    "required_context": ["リサーチプラン"],
    "output_schema": "method_v1",
    "quality_bar": ["再現可能", "指標が測定可能"],
    "escalation_rules": ["倫理的リスクがあれば上位へ"],
    "recommended_model_tier": "medium",
    "handles_task_types": ["research", "spec_design"]
  },
  {
    "agent_template_id": "Drafter",
    "role": "Drafter",
    "mission": "編集方針に沿って本文を起草する",
    "responsibilities": ["ドラフトを書く"],
    "allowed_actions": ["read_file", "search", "web_fetch", "write_file"],
    "forbidden_actions": ["production_deploy", "git_push", "secret_export", "file_delete", "external_api"],
    "required_context": ["編集プラン", "資料"],
    "output_schema": "draft_v1",
    "quality_bar": ["構成に沿っている"],
    "escalation_rules": ["事実性に疑義があれば Fact Checker へ"],
    "recommended_model_tier": "medium",
    "handles_task_types": ["content"]
  },
  {
    "agent_template_id": "ContainmentAgent",
    "role": "Containment Agent",
    "mission": "影響の拡大を止めるための封じ込め案を提示・適用する",
    "responsibilities": ["封じ込め手順を提示する"],
    "allowed_actions": ["read_repository", "run_static_analysis", "write_review_report"],
    "forbidden_actions": ["production_deploy", "secret_export", "file_delete", "db_update", "direct_code_merge"],
    "required_context": ["インシデント詳細", "影響範囲"],
    "output_schema": "containment_v1",
    "quality_bar": ["副作用が明示されている"],
    "escalation_rules": ["本番変更は人間承認ゲートへ"],
    "recommended_model_tier": "medium",
    "handles_task_types": ["incident_response"]
  },
  {
    "agent_template_id": "RecoveryAgent",
    "role": "Recovery Agent",
    "mission": "正常状態への復旧を実装する",
    "responsibilities": ["復旧手順を実装する", "検証する"],
    "allowed_actions": ["read_repository", "write_file", "run_test"],
    "forbidden_actions": ["production_deploy", "secret_export", "file_delete", "direct_code_merge"],
    "required_context": ["封じ込め結果", "正常状態の定義"],
    "output_schema": "recovery_v1",
    "quality_bar": ["復旧が検証されている"],
    "escalation_rules": ["本番反映は人間承認ゲートへ"],
    "recommended_model_tier": "medium",
    "handles_task_types": ["incident_response", "code_implementation"]
  },

  {
    "agent_template_id": "Investigator",
    "role": "Investigator",
    "mission": "原因を特定するために証拠を収集・分析する",
    "responsibilities": ["ログ/コードを調査する", "原因仮説を立てる"],
    "allowed_actions": ["read_file", "read_repository", "search", "run_static_analysis", "write_review_report"],
    "forbidden_actions": ["write_file", "production_deploy", "git_push", "secret_export", "file_delete"],
    "required_context": ["インシデント詳細", "ログ"],
    "output_schema": "investigation_v1",
    "quality_bar": ["仮説に証拠が紐づく"],
    "escalation_rules": ["秘密情報の関与が疑われたら上位へ"],
    "recommended_model_tier": "medium",
    "handles_task_types": ["incident_response", "research"]
  },
  {
    "agent_template_id": "LiteratureAnalyst",
    "role": "Literature Analyst",
    "mission": "関連文献・先行事例を抽出し要約する",
    "responsibilities": ["出典を収集する", "要点を抽出する"],